[
  {
    "id": "00f79436234ed97126f267a7",
    "subject": "math",
    "topic_key": "combinatorics",
    "difficulty": "hard",
    "stem": [
      {
        "type": "text",
        "text": "با ارقام $0, 1, 2, 3, 4, 5$ چند عدد سه رقمی مضرب ۳ با ارقام متمایز می‌توان ساخت؟"
      }
    ],
    "options": [
      [
        {
          "type": "text",
          "text": "$52$"
        }
      ],
      [
        {
          "type": "text",
          "text": "$36$"
        }
      ],
      [
        {
          "type": "text",
          "text": "$44$"
        }
      ],
      [
        {
          "type": "text",
          "text": "$40$"
        }
      ]
    ],
    "correct_option_index": 4,
    "solution": [
      {
        "type": "text",
        "text": "برای اینکه یه عدد مضرب ۳ باشه، باید جمع ارقامش مضرب ۳ باشه. \nاول زیرمجموعه‌های ۳ تایی از ارقاممون رو پیدا می‌کنیم که جمعشون به ۳ بخش‌پذیره.\nارقام رو بر اساس باقی‌مانده تقسیم بر ۳ دسته‌بندی می‌کنیم:\n$M_0 = \\{0, 3\\}$\n$M_1 = \\{1, 4\\}$\n$M_2 = \\{2, 5\\}$\n\nحالا چطوری ۳ عدد انتخاب کنیم که جمعشون به ۳ بخش‌پذیر باشه؟\nحالت ۱: هر ۳ رقم از یه دسته باشن. ما تو هیچ دسته‌ای ۳ تا رقم نداریم، پس این حالت صفره.\nحالت ۲: از هر دسته دقیقاً یه رقم انتخاب کنیم.\nانتخاب‌ها: $\\binom{2}{1} \\times \\binom{2}{1} \\times \\binom{2}{1} = 2 \\times 2 \\times 2 = 8$ زیرمجموعه.\n\nاین ۸ زیرمجموعه رو بر اساس حضور صفر جدا می‌کنیم، چون جایگشتهاشون فرق داره:\n- زیرمجموعه‌های بدون صفر (صفر انتخاب نشده، پس از $M_0$ رقم ۳ انتخاب شده):\nتعدادشون: $1 \\times 2 \\times 2 = 4$ زیرمجموعه. هر کدوم $3! = 6$ جایگشت دارن. پس $4 \\times 6 = 24$ عدد.\n\n- زیرمجموعه‌های با صفر (از $M_0$ رقم ۰ انتخاب شده):\nتعدادشون: $1 \\times 2 \\times 2 = 4$ زیرمجموعه. اینا صفر دارن، پس صفر تو جایگاه صدگان نمی‌تونه بیاد. تعداد جایگشت‌های هر کدوم می‌شه $2 \\times 2 \\times 1 = 4$ عدد. پس $4 \\times 4 = 16$ عدد.\n\nکل اعداد: $24 + 16 = 40$ عدد.\n\nگزینه‌ی 4 درسته."
      }
    ],
    "smart_shortcut": [
      {
        "type": "text",
        "text": "وقتی می‌خوای مضرب ۳ بسازی، سریع ارقام رو به ۳ سطل $M_0, M_1, M_2$ تقسیم کن. اینجا برای ۳ رقمی بودن، فقط می‌شه از هر سطل یکی برداشت (چون سطل‌ها ۲تایی‌ان). یعنی $2 \\times 2 \\times 2 = 8$ دسته.\nنصف این دسته‌ها عدد صفر دارن (۴ تا) و نصفشون ندارن (۴ تا). \nدسته‌های بدون صفر: $4 \\times 3! = 24$\nدسته‌های با صفر (چون صفر اول نمیاد): $4 \\times 4 = 16$\nجمعاً می‌شه ۴۰. خیلی مرتب و ساختارمند! ⚡"
      }
    ],
    "source_bank": "gauss",
    "provenance": {
      "kind": "existing",
      "edition": "gauss_pre_nardebam_v2",
      "question_number": null,
      "question_pdf": null,
      "question_page": null,
      "solution_page": null,
      "solution_origin": "existing"
    }
  },
  {
    "id": "01645e307b99d054976faffd",
    "subject": "math",
    "topic_key": "combinatorics",
    "difficulty": "hard",
    "stem": [
      {
        "type": "text",
        "text": "تعداد جواب‌های طبیعی معادله‌ی $x+y+z=12$ به طوری که $x, y, z$ همگی اعداد زوج باشند، کدام است؟"
      }
    ],
    "options": [
      [
        {
          "type": "text",
          "text": "$15$"
        }
      ],
      [
        {
          "type": "text",
          "text": "$10$"
        }
      ],
      [
        {
          "type": "text",
          "text": "$21$"
        }
      ],
      [
        {
          "type": "text",
          "text": "$28$"
        }
      ]
    ],
    "correct_option_index": 2,
    "solution": [
      {
        "type": "text",
        "text": "چون قراره $x, y, z$ اعداد طبیعیِ زوج باشن، با تغییر متغیر اون‌ها رو به فرم اعداد زوج درمیاریم:\n$x = 2a$\n$y = 2b$\n$z = 2c$\nچون گفته «طبیعی» (یعنی صفر نباشن)، پس $a, b, c$ باید اعداد صحیح **مثبت** ($a, b, c \\ge 1$) باشن.\n\nاین تغییر متغیر رو تو معادله می‌ذاریم:\n$$2a + 2b + 2c = 12$$\n$$a + b + c = 6$$\n\nحالا دنبال تعداد جواب‌های صحیح مثبت (طبیعی) برای این معادله‌ی جدید هستیم.\nفرمولش $\\binom{n-1}{k-1}$ بود:\n$$\\binom{6-1}{3-1} = \\binom{5}{2} = 10$$\n\nپس کلا ۱۰ جواب مطلوب داریم. گزینه‌ی 2 درسته."
      }
    ],
    "smart_shortcut": [
      {
        "type": "text",
        "text": "وقتی می‌گه همه زوج باشن، سریع کل معادله رو بر ۲ تقسیم کن! $x+y+z=12$ می‌شه $a+b+c=6$. چون گفته بودن عدد طبیعی (یعنی صفر نه)، پس جواب‌های مثبت $a+b+c=6$ رو می‌خواد که می‌شه $\\binom{6-1}{3-1} = 10$. ۵ ثانیه‌ای حل می‌شه! ⚡"
      }
    ],
    "source_bank": "gauss",
    "provenance": {
      "kind": "existing",
      "edition": "gauss_pre_nardebam_v2",
      "question_number": null,
      "question_pdf": null,
      "question_page": null,
      "solution_page": null,
      "solution_origin": "existing"
    }
  },
  {
    "id": "02cb290dd6bea082c68c02a5",
    "subject": "math",
    "topic_key": "combinatorics",
    "difficulty": "hard",
    "stem": [
      {
        "type": "text",
        "text": "تعداد جواب‌های معادله‌ی $x_1+x_2+x_3=10$ در مجموعه‌ی اعداد صحیح **مثبت** چقدر است؟"
      }
    ],
    "options": [
      [
        {
          "type": "text",
          "text": "$45$"
        }
      ],
      [
        {
          "type": "text",
          "text": "$55$"
        }
      ],
      [
        {
          "type": "text",
          "text": "$66$"
        }
      ],
      [
        {
          "type": "text",
          "text": "$36$"
        }
      ]
    ],
    "correct_option_index": 4,
    "solution": [
      {
        "type": "text",
        "text": "این ساده‌ترین حالت معادله‌ی سیب‌هاست که معمولاً بچه‌ها تو نامنفی و مثبت بودنش قاطی می‌کنن.\nوقتی می‌گه «صحیح مثبت»، یعنی $x_i \\ge 1$.\n\nبا تغییر متغیر $y_i = x_i - 1 \\ge 0$، معادله تبدیل می‌شه به:\n$$(y_1+1) + (y_2+1) + (y_3+1) = 10$$\n$$y_1+y_2+y_3 = 7$$\n\nحالا فرمول اصلی رو می‌زنیم (ترکیب با تکرار):\n$$\\binom{n+k-1}{k-1} = \\binom{7+3-1}{3-1} = \\binom{9}{2}$$\n\nحسابش می‌کنیم:\n$$\\binom{9}{2} = \\dfrac{9 \\times 8}{2} = 36$$\n\nگزینه‌ی 4 درسته."
      }
    ],
    "smart_shortcut": [
      {
        "type": "text",
        "text": "شورتکات «صحیح مثبت»: فرمولش مستقیم می‌شه $\\binom{N-1}{k-1}$.\nاینجا $N=10$ و $k=3$. پس سریع می‌گی $\\binom{10-1}{3-1} = \\binom{9}{2} = 36$. اصلاً نیاز به تغییر متغیر نیست، فقط کافیه یکی از $N$ و یکی از $k$ کم کنی! ⚡"
      }
    ],
    "source_bank": "gauss",
    "provenance": {
      "kind": "existing",
      "edition": "gauss_pre_nardebam_v2",
      "question_number": null,
      "question_pdf": null,
      "question_page": null,
      "solution_page": null,
      "solution_origin": "existing"
    }
  },
  {
    "id": "053f97505a84c52fdbb0cee0",
    "subject": "math",
    "topic_key": "combinatorics",
    "difficulty": "hard",
    "stem": [
      {
        "type": "text",
        "text": "تعداد جواب‌های طبیعی معادله‌ی $x + y + z + w = 20$ چقدر است به طوری که تمام متغیرها فرد باشند؟"
      }
    ],
    "options": [
      [
        {
          "type": "text",
          "text": "$286$"
        }
      ],
      [
        {
          "type": "text",
          "text": "$165$"
        }
      ],
      [
        {
          "type": "text",
          "text": "$220$"
        }
      ],
      [
        {
          "type": "text",
          "text": "$84$"
        }
      ]
    ],
    "correct_option_index": 2,
    "solution": [
      {
        "type": "text",
        "text": "ببین رفیق، شرط فرد بودن متغیرها رو باید با تغییر متغیر لحاظ کنیم. \nفرض می‌کنیم هر متغیر به شکل یه عدد فرد باشه. چون گفت طبیعی (یعنی از ۱ شروع می‌شه)، می‌نویسیم:\n$x = 2a + 1$\n$y = 2b + 1$\n$z = 2c + 1$\n$w = 2d + 1$\nکه اینجا $a, b, c, d$ اعداد صحیح نامنفی (بزرگتر مساوی صفر) هستن.\n\nحالا اینا رو جایگذاری می‌کنیم تو معادله اصلی:\n$$(2a + 1) + (2b + 1) + (2c + 1) + (2d + 1) = 20$$\n$$2(a + b + c + d) + 4 = 20$$\n$$2(a + b + c + d) = 16$$\n$$a + b + c + d = 8$$\n\nحالا فقط باید تعداد جواب‌های نامنفی این معادله‌ی جدید رو پیدا کنیم. فرمولش که می‌دونی چیه:\n$$\\binom{n+k-1}{k-1} = \\binom{8+4-1}{4-1} = \\binom{11}{3}$$\n\nخب حسابش می‌کنیم:\n$$\\binom{11}{3} = \\dfrac{11 \\times 10 \\times 9}{3 \\times 2 \\times 1} = 11 \\times 5 \\times 3 = 165$$\n\nپس ۱۶۵ جواب مطلوب داریم. گزینه‌ی 2."
      }
    ],
    "smart_shortcut": [
      {
        "type": "text",
        "text": "شورتکات: وقتی جمع $k$ تا متغیر فرد می‌شه $2N$، خیلی سریع متغیرها رو به شکل $2a+1$ فرض کن. مجموعشون می‌شه $2\\Sigma a + k = 2N$. یعنی $\\Sigma a = N - k/2$. حالا فرمول نامنفی رو بزن: $\\binom{(N-k/2) + k - 1}{k-1}$. اینجا $N=10, k=4$ پس $\\Sigma a = 8$ و جواب می‌شه $\\binom{8+3}{3} = 165$. بدون نوشتن اضافی رو کاغذ! ⚡"
      }
    ],
    "source_bank": "gauss",
    "provenance": {
      "kind": "existing",
      "edition": "gauss_pre_nardebam_v2",
      "question_number": null,
      "question_pdf": null,
      "question_page": null,
      "solution_page": null,
      "solution_origin": "existing"
    }
  },
  {
    "id": "0a129b32eaf235944f6d0650",
    "subject": "math",
    "topic_key": "combinatorics",
    "difficulty": "hard",
    "stem": [
      {
        "type": "text",
        "text": "با ارقام ۰، ۱، ۲، ۳، ۴، ۵ چند عدد سه رقمی می‌توان ساخت که مضرب ۵ باشند؟ (ارقام می‌توانند تکرار شوند)"
      }
    ],
    "options": [
      [
        {
          "type": "text",
          "text": "$36$"
        }
      ],
      [
        {
          "type": "text",
          "text": "$60$"
        }
      ],
      [
        {
          "type": "text",
          "text": "$72$"
        }
      ],
      [
        {
          "type": "text",
          "text": "$45$"
        }
      ]
    ],
    "correct_option_index": 2,
    "solution": [
      {
        "type": "text",
        "text": "برای اینکه عددی مضرب ۵ باشه، رقم یکانش باید ۰ یا ۵ باشه.\nما اعداد ۳ رقمی می‌خوایم: $\\square \\,\\square \\,\\square$\n\nچون ارقام می‌تونن تکرار بشن، کارمون راحت‌تره، اما حواسمون باشه که تو رقم اول (صدگان) صفر نمی‌تونه بیاد.\n- صدگان: می‌تونه ۱، ۲، ۳، ۴ یا ۵ باشه (۵ انتخاب)\n- دهگان: می‌تونه هر رقمی باشه، حتی صفر (۶ انتخاب)\n- یکان: باید ۰ یا ۵ باشه تا عدد مضرب ۵ بشه (۲ انتخاب)\n\nتعداد کل اعداد طبق اصل ضرب می‌شه:\n$$5 \\times 6 \\times 2 = 60$$\n\nگزینه‌ی 2 درسته."
      }
    ],
    "smart_shortcut": [
      {
        "type": "text",